text_id,text,linenumber
cr03,And did he appreciate my efforts on his behalf ?,666
cr03,"Did he trouble to memorize the very small part which I had `` tailor-made '' to his specifications , a role eventually cut down to three short speeches ?",667
cr03,Did he show the rest of the cast -- numbering four thousand -- the consideration of arriving at the studio punctually -- or even at all ?,668
cr03,He did not !,669
cr03,The `` shooting '' went on for eight months !,670
cr03,"Most of our working days were spent on the telephone calling `` bookies '' , illegal gambling dens , a certain `` residential club for young actresses '' , more than a hundred different bars or the steam room of the athletic club .",671
cr03,"Whenever he deigned to appear at the studio he was `` hung over '' , uncooperative , rude and insulting .",672
cr03,"He made many tasteless , irreverent and unfunny remarks , not only about me in the title role , but about religion in general .",673
cr03,"By the time the film was released we were three million dollars over-spent , war was imminent and the public apparently had forgotten all about Mother Cabrini .",674
cr03,"Thanks to Letch Feeley and the terrible strain he imposed on me , the notices were few and unfavorable .",675
cr03,Only George Santayana seemed to understand and appreciate the film when he wrote : `` Miss Poitrine has perpetrated the most eloquent argument for the Protestant faith yet unleashed by Hollywood '' .,676
cr03,But it was small consolation .,677
cr03,"In a rare fit of anger and spite , I `` farmed out '' my own husband to a small and most undistinguished studio to make one picture as a form of punishment .",678
cr03,( An actor must have discipline . ),679
cr03,"The film was called The Diet of Worms , which I felt was just what Letch deserved .",680
cr03,"It turned out to be a life of Martin Luther , of all things !",681
cr03,It was a disaster !,682
cr03,"In clothes , Letch simply did not project .",683
cr03,He was laughed off the screen .,684
cr03,"At the same time , however , I availed myself of the services of that great English actor and master of make-up , Sir Gauntley Pratt , to do a `` quickie '' called The Mystery of the Mad Marquess , in which I played a young American girl who inherits a haunted castle on the English moors which is filled with secret passages and sliding panels and , unbeknownst to anyone , is still occupied by an eccentric maniac .",685
cr03,"It was a `` potboiler '' made on a `` shoestring '' and not the sort of film I like , as all I had to do was look blank and scream a great deal .",686
cr03,"My heart was not in it , but , oddly enough , it remains the most financially successful picture of my career .",687
cr03,"( I watched it on television late one night last week and it `` stands up '' remarkably well , even twenty years later . )",688
cr03,Letch had returned from his debacle unrepentant and more badly behaved than before .,689
cr03,"I really loved that boy , and , in a feverish attempt to preserve our marriage and to try to revive the wonderful , wonderful person Letch had once been , I took my troubles to Momma , hoping that her earthy advice would help me .",690
cr03,"`` If I could only think of something at the studio , near me , to absorb his boundless energy '' , I said .",691
cr03,`` What is Letch interested in '' ?,692
cr03,"`` Bookies , booze and babes '' , Momma said bluntly .",693
cr03,"Her reply stung me , but this was too important to let my hurt make any difference .",694
cr03,"`` I can't turn the studio into a gambling hell or a saloon '' , I said .",695
cp06,"How , he wondered , does one enjoy one's spare time ?",696
cp06,He considered some interesting excursion but he was on the road every day from dawn to dusk .,697
cp06,"Then there was exercise , boating and hiking , which was not only good for you but also made you more virile : the thought of strenuous activity left him exhausted .",698
cp06,"Perhaps golf , with a fashionable companion -- but he'd lost his clubs , hadn't played in years .",699
cp06,"There was swimming over at the Riverside Hotel , but his skin was so white he looked like the bottom of a frog .",700
cp06,"Perhaps a packing trip into the Sierras , let his beard grow -- but that was too stark .",701
cp06,"I could , he thought , take a long walk -- but where ?",702
cp06,The telephone rang .,703
cp06,"`` You missed it '' , Buzz's voice said , `` You should have gone over to the Pagan Room with us .",704
cp06,Wow .,705
cp06,"Strippers , but scrumptious , and Toodle Williams and her all-lesbian band '' .",706
cp06,"`` Hi , Buzz '' , Owen said .",707
cp06,`` I went over to the Willows and dropped two notes '' .,708
cp06,"`` Tough '' , Buzz said , `` Listen , we're having a stag dinner over at the Pagan Room on Friday .",709
cp06,Imagine a stag dinner with Toodle Williams '' .,710
cp06,He laughed and laughed .,711
cp06,"Owen wanted to be pleasant because Buzz worked the territory next to his , but he hadn't come to Reno for stag dinners .",712
cp06,"`` Thanks '' , Owen said , `` but Friday is a long way off and anything can happen '' .",713
cp06,Buzz was a tireless instigator who never let his victims rest .,714
cp06,"When Owen was finally rid of him , there was a timid rap at the door .",715
cp06,"`` Yes '' , Owen called out .",716
cp06,`` Yes '' ?,717
cp06,"`` I'm Mrs. Gertrude Parker '' , a soft voice explained , `` And I'd like to talk to you for a few minutes , please '' .",718
cp06,"Ahah , he thought , a lush divorcee at last .",719
cp06,Probably saw me in the lobby .,720
cp06,"He was disappointed to find a nervous , scrawny woman with a big hat standing at the door .",721
cp06,She frowned at his green pajamas with the yellow moons .,722
cp06,`` How do you do '' ?,723
cp06,"She said , semi-professionally .",724
cp06,`` Our church is sponsoring a group of very courageous women up in Alaska .,725
cp06,We call them lay-sisters and they go among the Eskimos making friends and bringing the light .,726
cp06,They're up there in that freezing climate and all of us have to try and help them '' .,727
cp06,`` Oh '' ?,728
cp06,"`` You see '' , she said , looking past him into the room , where the highball glasses sparkled dully in the bright light , `` you and I can't understand the many hardships they have to undergo '' .",729
cp06,`` Why is that '' ?,730
cp06,She apparently wasn't satisfied with his reaction .,731
cp06,"Smug , Owen thought , smug and sappy .",732
cp06,There was a slight nervous twitch in the region of her left eye .,733
cp06,"It gave her a lewd , winking effect .",734
cp06,`` Have you ever tried to reason with an Eskimo '' ?,735
cp06,"She asked , winking wildly .",736
cp06,`` They are a very difficult group of people '' .,737
cp06,"`` I don't know much about them '' , Owen admitted , `` but I suppose they have their own religion and they probably resent outsiders coming in and telling them what to do and what not to do '' .",738
cp06,She smiled in a sickly-tolerant fashion .,739
cp06,"`` You know , that's very interesting .",740
cp06,People don't know how much they give away about themselves by remarks like that .,741
cp06,"The more canvassing I do , the more I note how far most people are from their personal God '' .",742
cp06,"Forebearing , Owen kept his peace .",743
cp06,What would happen next ?,744
cp06,"That she was out for a touch was certain , but when did she get to the pitch ?",745
cp06,"Several people passed in the hall and stared as he slowly retreated , trying to close the door a little , and she slowly leaned toward him and raised her voice .",746
cp06,`` How did you get by the desk '' ?,747
cp06,He asked curiously .,748
cp06,"`` I'm sure the hotel doesn't know you're wandering around the corridors , knocking on strangers' doors and talking down Eskimos '' .",749
cp06,"`` Oh , I just come once a week .",750
cp06,Every day I visit a different hotel .,751
cp06,I feel it's my duty .,752
cp06,"I do this work all on my own , because I understand the difficulties and I want to help these lay-sisters .",753
cp06,"Do you know these women go all through Alaska , and they don't have the proper facilities ?",754
cp06,They travel in pairs as much as a hundred-and-fifty miles a day '' .,755
cp06,`` Do you have any idea how far I travel every day ?,756
cp06,I have the whole Pacific Northwest '' .,757
cp06,Owen was aware he was getting overexcited but he couldn't help himself .,758
cp06,Mrs. Gertrude Parker drew back .,759
cp06,"`` That's hardly a Christian approach '' , she remonstrated .",760
cp06,`` You're in the secular world '' .,761
cp06,`` I didn't say it was Christian .,762
cp06,I don't think you'll find many active Christian salesmen .,763
cp06,"Not that religion isn't big business ; ; those bibles and prayer books make a lot of money for publishing houses , but they don't get top personnel .",764
cp06,Our key salesmen are in appliances and cosmetics '' .,765
cp06,"`` God , I take it , plays no part in this '' , she said waspishly .",766
cp06,"`` God doesn't have any appliance or cosmetics '' , he said heatedly before he caught himself .",767
cp06,It sounded silly ; ; why go on ?,768
cp06,More people were passing ; ; he had to find some way to close this impossible conversation .,769
cp06,"`` And whiskey '' , she said , smiling and blinking at the highball glasses .",770
cp06,`` Don't forget whiskey ; ; it's such a big seller '' .,771
cp06,"`` You know '' , he said , getting a grip on himself , `` I think you're going to have to excuse me .",772
cp06,I have an appointment '' .,773
cp06,"`` I can imagine '' , she said .",774
cp06,`` Probably down at the bar .,775
cp06,But what do you want to do about the lay-sisters ?,776
cp06,They must be freezing up there now .,777
cp06,Can't you help them '' ?,778
cp06,`` Leave a card or something .,779
cp06,I'll think it over '' .,780
cp06,"`` I have no card '' , she said bitterly .",781
cp06,`` You haven't been listening to what I've been telling you .,782
cp06,"I only hope my talking to you has helped you a little , anyway , because you need spiritual bucking-up '' .",783
cp06,"She looked crestfallen , as if he had somehow disappointed the whole human race .",784
cp06,"She stood indecisively for a moment , then walked down the hall ; ; he heard her knocking on another door .",785
cp06,It took him about fifteen minutes to calm himself ; ; then he realized he was hungry .,786
cp06,"He showered , shaved , dressed and went down to the dining room for breakfast .",787
cp06,On the way he stopped at the desk to receive his mail .,788
cp06,"There was a check from his company , and the usual enthusiastic bulletins on new lines they always issued .",789
cp06,"His lawyer had sent him a statement on his overdue alimony , and there was a letter from the Collector of Internal Revenue asking him to stop in his office and explain last year's exemptions .",790
cp06,"He ate breakfast in a sullen mood , but afterwards , when he walked out onto Virginia Street , he felt braced .",791
cp06,"He looked off to the crest of the Sierras , still white-topped ; ; the glisten of the Truckee River made a wide spangle .",792
cp06,"He felt suddenly elated , adventurous .",793
cp06,With any luck at all he could easily find a flowerpot .,794
cp06,"Although it was only three o'clock , he stopped in at the Golden Calf .",795
cp06,"The tables were all spinning , the dice rattling , the bar crowded .",796
cp06,"Just to test himself , he played roulette for quarters on his old combination , five and seventeen , and within an hour , he had won , surprisingly , twenty dollars .",797
cp06,"The way was opening up ; ; when the management brought around champagne , the breakfast settled its whirling around in his stomach .",798
cp06,The Golden Calf was dimly lit with shaded neon .,799
cp06,"There were more women than men in the place , but he couldn't find a flowerpot .",800
cp06,"They all had the hard look of gamblers who had stopped dreaming , who automatically turned the cards , hardly caring what showed up .",801
cp06,"The mural around the wall depicted early settlers in covered wagons , who appeared much more animated than the gamblers .",802
cp06,"The women had a bright shining expectancy as they leaned out from the wall and gazed splendidly into the distance , while the men were stern but hopeful .",803
cp06,"All , of course , except the Donner party who were bent on starving to death .",804
cp06,"`` I wonder if they did eat each other at the end '' , Owen mused .",805
cp06,"He sat down next to a heavily-upholstered blonde , but she was cleaned out in twenty minutes .",806
cp06,She sighed a dirty word and left .,807
cp06,Owen was surprised to see Mrs. Gertrude Parker playing the one-arm bandits that were cunningly arranged by the entrance .,808
cp06,"She sat down and played two slots at once , looking grim , as if bested by mechanical devices , and Owen felt sorry for the lay-sisters depending on her support .",809
cp06,A dried-up cowboy sat down next to him in the blonde's place .,810
cp06,He was a little more authentic than usual because he smelled slightly of the stables .,811
cp06,"`` What you need is a steady martingale '' , the cowboy announced after watching Owen play .",812
cp06,`` You can't build on your hit-and-miss five-seventeen '' .,813
cp06,`` What are you playing '' ?,814
cp06,Owen asked .,815
cp06,"`` I'm just logging '' , the cowboy explained .",816
cp06,"`` I keep all these plays in this little black book , and I watch over a twelve-hour period to find out what numbers are repeating .",817
cp06,But roulette's not my game .,818
cp06,I'm always trying to find a breaking table in blackjack .,819
cp06,"Incidentally , I'm pretty famous in these parts : I'm called The Wrangler '' .",820
cp06,`` Nice to know you .,821
cp06,Don't you have to spend any time on your ranch '' ?,822
cp06,"`` Well , of course I do .",823
cp06,"I'm with the Bar-H , pushing a horse called Sparky .",824
cp06,"He's my own horse , and what I collect from him I use on blackjack .",825
cp06,This Sparky can rack and single-foot and he's the fastest thing in Washoe County .,826
cp06,"I figure if I can get any kind of publicity campaign going , I'll land him on TV -- you know , one of those favorite horses for some Western hero .",827
cp06,"I once trained a horse for Hoot Gibson , but nothing like Sparky .",828
cp06,He's a pinto and he photographs wonderfully '' .,829
cp06,"Five came up while Owen was listening to The Wrangler and he neglected to play , a loss of ten dollars .",830
cp06,"This proved conclusively that The Wrangler was a jinx , so he walked on down to Hurrays , an even more glorified gambling den than the Golden Calf .",831
cp06,"When he looked in the back , Mrs. Gertrude Parker was marking keno cards .",832
cp06,His adventurous spirit had waned ; ; he studied the pistol exhibition that Hurrays featured as an added attraction .,833
cp06,"He ogled a long redhead with green eyes , but she was a shill with her money in front of her .",834
cp06,He had no great prejudice against shills ; ; it just seemed such a dry run .,835
cp06,There was no cash around ; ; everyone was flipping silver dollars .,836
cp06,The management discreetly withdrew the green stuff into the office and gave the customers chips or checks or premium points .,837
cp06,He read a special announcement whereby Hurrays would feature a special floorshow at three A.M. starring Adele ( The Body ) Brenner and fourteen glamorous schoolgirls .,838
cp06,"He wondered if he might bag a tourist , but they looked frightened of him .",839
cp06,"He passed two brides , both wearing orchids , and they made him feel a little sad .",840
cp06,Owen found Buzz watching chuck-a-luck .,841
cp06,Buzz had on a Hawaiian shirt and was carrying some sun-tan oil and dark glasses .,842
cp06,"He was shorter and fatter than Owen , who felt good standing next to him .",843
cp06,"`` We're all going over to Lake Tahoe and try our luck at Cal-Neva '' , Buzz explained , still instigating .",844
cp06,`` We ran into a guy at the Pagan Room who guarantees we can beat the wheel .,845
cp06,"He started out as a stickman , then became a pit boss until the Club found him crossroading .",846
cp06,He was knocking down checks at faro '' .,847
cp06,"`` I'm allergic to Tahoe '' , Owen explained .",848
cp06,`` Something about the pollen '' .,849
cp06,"`` Well , okay '' , Buzz said .",850
cp06,`` We'll see you around later '' .,851
cp06,"Owen went over to the crap table and the dice were hot , but he couldn't pyramid with any consecutive success .",852
cp06,"`` How's your luck , honey '' ?",853
cp06,A short platinum blonde in a bursting sun-suit addressed him .,854
cp06,"She looked well-fed and prosperous , but he didn't get the impression he was being propositioned the way he'd been hoping .",855
cp06,`` I haven't had any luck since I was a baby '' .,856
cp06,"`` Stake me '' , she said , `` and let me at those dice .",857
cp06,I'll make them dance the tango .,858
cp06,We'll get it in a hurry and get it out '' .,859
cp06,`` Let's have a drink and discuss a merger '' .,860
cp06,"`` If you go broke '' , she said , smiling up at him , `` I'll leave you '' .",861
cp06,"`` Sounds like real love '' , Owen said .",862
cp06,`` It sort of brings a lump to my throat '' .,863
cp06,"`` My name's Gisele '' , the blonde said after she ordered a Scotch .",864
cp06,`` Named after the ballet .,865
cp06,"My mother wanted to call me Sylphide , but it sounded too affected '' .",866
cp23,"Under normal circumstances , he had a certain bright-eyed all-American-boy charm , with great appeal for young ladies , old ladies , and dogs .",867
cp23,"Today , he looked like an Astronaut who had left his vitamin pills on the bureau and spent six months in space : hollow eyes , hollow cheeks , hollow stomach .",868
cp23,"Breakfast , he thought .",869
cp23,A shot of orange juice would make everything seem better .,870
cp23,"He looked around his little Eden : bureau , bed , table , chair , two-burner stove .",871
cp23,Then he remembered .,872
cp23,"`` You share a refrigerator '' , Mrs. Kirby had said , and somehow , at midnight , after the long drive from New York in pelting rain , that had sounded reasonable .",873
cp23,"In the cold light of day , it seemed a lunatic arrangement .",874
cp23,"Share bath , maybe -- but share refrigerator ?",875
cp23,She had explained it -- something about summer people's eating out and not enough space in the units .,876
cp23,And where was the thing ?,877
cp23,"He remembered seeing it last night , when he put away his small store of bachelor-type eatables .",878
cp23,"Ah , yes -- his half of a refrigerator stood outside , on the `` curving veranda '' between Unit Number Three and Unit Number Four .",879
cp23,"It was still raining , and Mrs. Kirby's cottages bloomed through the gray haze like the names they bore , vivid blue and green and magenta .",880
cp23,"Charlie downed his orange juice and one of the long , skinny green pills , his spirits as damp as the day .",881
cp23,"This vacation had seemed like a good idea last week , when his doctor had prescribed it .",882
cp23,"`` Take a full month '' , the doctor had said .",883
cp23,"`` Lots of sun , lots of rest .",884
cp23,The red pills are a vitamin-and-iron compound .,885
cp23,This is a sleeping capsule .,886
cp23,The others will make you a little more comfortable until you get it licked .,887
cp23,"You young men get to be my age , you won't take flu so lightly '' .",888
cp23,Charlie had accepted the diagnosis without comment .,889
cp23,"The doctor could call it anything from flu to beriberi ; ; but Charlie knew what was wrong with him and knew , too , that there was no pill to cure it .",890
cp23,"He had loved and lost Vivian Wayne to somebody else , had watched her marry the somebody else , and had caught a bear of a cold by kissing the bride good-by forever , which was really piling it on .",891
cp23,"He had caught , too , like an ailment , a confirmed distrust of women .",892
cp23,"Once burned -- scalded , really , because Vivian had given him every encouragement -- forever shy .",893
cp23,"From now on , his was going to be a man's world : the North Woods , duck blinds at dawning , beer and poker and male secretaries .",894
cp23,"Meanwhile , he had this miserable cold , and as he leaned against the refrigerator , watching the rain make sandy puddles at his feet , the doctor's prescription for lots of sun seemed like a hollow mockery .",895
cp23,"In these damp circumstances , he was an odds-on bet to develop pneumonia .",896
cp23,"He looked up to see Mrs. Kirby , awesome in a black-and-yellow polka-dotted slicker , bearing down on him .",897
cp23,`` Three-day blow '' !,898
cp23,She bellowed triumphantly .,899
cp23,He had noticed before that the natives seemed to regard really filthy weather as a kind of Pyhrric victory over the tourists .,900
cp23,"`` Fine , day after tomorrow '' , she added .",901
cp23,"`` I hope so '' , he said .",902
cp23,`` I've got this cold .,903
cp23,Thought I'd bake it out in the sun '' .,904
cp23,`` Ah '' .,905
cp23,She studied him briefly .,906
cp23,`` You've got a peaked look .,907
cp23,Better get in out of the wet '' .,908
cp23,"Charlie forbore to mention that the wet was somewhat universal , Peony being less than weatherproof .",909
cp23,"As for its being fine , day after tomorrow , he had the unhappy conviction that it would never be fine again , with Vivian lost to him forever .",910
cp23,"He could imagine her at this minute , honeymooning in Nassau with what's-his-name , lounging on golden sands , looking forward to a life of unalloyed bliss .",911
cp23,"All Charlie could look forward to was a yellow pill at noon , a salami sandwich for lunch , and a lonely old age -- if he lived that long .",912
cp23,"He leafed through the light reading provided by Mrs. Kirby for her guests : four separate adventures of the Bobbsey Twins ( At the Seashore , At the Mountains , On the Farm , and In Danger ) and several agricultural bulletins on the treatment of hoof-and-mouth disease in cattle , hideously illustrated .",913
cp23,"He dozed , only to dream of Vivian , and woke , only to crash into the night table , bruising his other shin .",914
cp23,"He took a yellow pill , only to choke on it , and went for the salami , only to find something alive in the refrigerator -- something pink and fuzzy .",915
cp23,"His first thought was that Mrs. Kirby , in her mania for color , had dyed a cat and that cat had somehow managed to open the refrigerator door and climb in ; ; but on further investigation , the thing proved to be a sweater , of the long-hair variety that sheds onto men's jackets -- pale , pale pink and , according to the label , size thirty-four .",916
cp23,"He thought about it for a minute , could find no reasonable explanation for the presence of a sweater in the refrigerator , got the salami , bread , and a Bermuda onion , and put the whole thing out of his mind .",917
cp23,"Next morning , he found a note in the refrigerator .",918
cp23,`` Would you mind wrapping your onion '' ?,919
cp23,Said this note .,920
cp23,`` The smell permeates everything '' !,921
cp23,"Everything being the sweater , a lipstick case , and a squirt bottle of Kissin' Kare pink hand lotion .",922
cp23,"The note paper was pink , too , and the handwriting small and dainty and utterly feminine .",923
cp23,"Not that he had supposed , considering the evidence , that he was sharing this refrigerator with a member of the Beach Patrol .",924
cp23,"He scrawled `` Sorry '' across the bottom of the note and then , against his better judgment , added : `` Don't you eat '' ?",925
cp23,"He didn't want to encourage anything here ; ; but on the other hand , he didn't want her swiping his salami .",926
cp23,"`` Not onions '' , came the answer the following day .",927
cp23,`` Ugh '' .,928
cp23,"Must have really smelled up her sweater , he thought , and wondered idly just why she kept the sweater fast-frozen .",929
cp23,"But then , as he well knew , women are not guided by logic or common sense .",930
cp23,Take Vivian .,931
cp23,"Yes , take Vivian .",932
cp23,Somebody had .,933
cp23,"Now , if this were Vivian next door to him and if , for some obscure female reason , she kept her clothes in the refrigerator , they would not be pink .",934
cp23,"They would be black or white or horse-blanket plaid , chic and splashy , like Vivian herself .",935
cp23,"Pink , Vivian once had told him , was for baby girls , and grown-up girls who wore pink were subconsciously clinging to their infancy .",936
cp23,`` Why does this girl keep a sweater in the refrigerator '' ?,937
cp23,He mused aloud .,938
cp23,Eh '' ?,939
cp23,"It was Mrs. Kirby , making her toilsome way along the veranda , laden with a clattery collection of mops , brushes , and pails .",940
cp23,`` What's that you say '' ?,941
cp23,"`` Oh , nothing .",942
cp23,Just glad the rain's stopped '' .,943
cp23,"`` Oh , yes .",944
cp23,Just look at that sky .,945
cp23,Be a scorcher by afternoon '' .,946
cp23,`` I hope so .,947
cp23,I've got this cold '' .,948
cp23,`` So you said '' .,949
cp23,She scrutinized him .,950
cp23,"`` My , you're peaked .",951
cp23,"You want to watch out that you don't get burned to an ash , first sunny day .",952
cp23,I must remember to warn the girl next to you in Larkspur .,953
cp23,That pale kind's the worst '' .,954
cp23,"That pale kind , Charlie thought .",955
cp23,Hardly an inviting description .,956
cp23,"But then , neither was peaked .",957
cp23,"He could hear Mrs. Kirby now , warning her pale guest against sunburn .",958
