text_id,text,linenumber
cn29,"`` Bastards '' , he would say , `` all I did was put a beat to that Vivaldi stuff , and the first chair clobbered me '' !",1
cn29,"Since then , and since the pure grain had gotten him divorced from every decent -- and even indecent -- group from Greenwich Village to the Embarcadero , he had become a sucker-rolling freight-jumper .",2
cn29,"`` There ain't nothin' faster , or lonelier , or more direct than a cannonball freight when you wanna go someplace '' , Feathertop would say .",3
cn29,"`` The accommodations may not be the poshest , but man !",4
cn29,"There ain't nobody askin' for your ticket stub , neither '' .",5
cn29,"He had been conning the freights for a long , long time now .",6
cn29,"Ever since the hooch , and the trouble with the Quartet , and Midge and the child .",7
cn29,Ever since all that .,8
cn29,It had been a very long time that had no form and no end .,9
cn29,He was -- as he told himself in the vernacular of a trade no longer his own -- riding the dark train out .,10
cn29,Out and out and never to return again .,11
cn29,"Till one day the last freight had been jumped , the last pint had been killed , the last beat had been rapped .",12
cn29,That was the day it ended .,13
cn29,"The freight car was cold , early in the morning .",14
cn29,"He was pressed far back into the corner of the car on his hay sacks , the rattling and tinning of the wheels on the rails almost covering the sound of his ocarina .",15
cn29,"He held his elbows away from his body , and the little sweet potato trilled neatly and sweetly as he tickled its tune-belly .",16
cn29,"The train slowed at a road crossing , and the big door slid open ; ; at first gratingly , caught by grains of corn -- then with a clash into its slot .",17
cn29,The boy lifted the girl by the waist and set her on the lip of the floor .,18
cn29,"She pulled her legs up under her , to rise , her full peasant skirt drawing up her thighs , and Feathertop's music pfffted away .",19
cn29,"`` Now that is a very nice , a very nice '' , he murmured to himself , back in his corner .",20
cn29,"A little thing , but the right twist for the action that counted .",21
cn29,"Hot , that was the word , hot !",22
cn29,"Hair like a morning-frightened sparrow's wings , with the sun shining down over them .",23
cn29,"A poet , yet !",24
cn29,"His thoughts for the swanlike neck , the full , high breasts , the slim waist , and the long legs were less than poetic , however .",25
cn29,Zingggg-O !,26
cn29,"Then the boy straight-armed himself up , twisting at the last moment so he landed sitting .",27
cn29,"He was less to see , but Feathertop took him in , too , just to keep the records straight .",28
cn29,"Curly hair , high cheekbones , wide gnomelike mouth , a pair of drummer's blocky hands , and a body that said well , maybe I can wrestle you for ten minutes -- but then I'm finished .",29
cn29,"`` We made it , Cappy '' , the chick said .",30
cn29,"`` Yeah , seems so , don't it '' , the boy laughed , hugging her close .",31
cn29,`` Ah-ah '' !,32
cn29,"Feathertop interrupted , standing up , brushing the pig offal from his dirty pants .",33
cn29,`` None of that .,34
cn29,We run a respectable house here '' .,35
cn29,"They whirled and saw him , standing there dim in the slatted light from the boarded freight wall .",36
cn29,"He was big , and filthy , and his toes stuck out of the flapping tops of his shoes .",37
cn29,He held the black plastic kazoo lightly .,38
cn29,"`` Come sit '' , said Feathertop , motioning them toward him .",39
cn29,`` That crap is softer over here '' .,40
cn29,"The girl smiled , and started forward .",41
cn29,"The boy yanked her back hard , tugging her off her feet , and gathered her into the crook of his arm .",42
cn29,"`` Now stay with me , Kitty '' , he snapped irritably .",43
cn29,`` I vowed to take care of you -- and that's what I'm gonna do .,44
cn29,We don't know this guy '' .,45
cn29,"`` Oooo , square bit '' , Feathertop screwed his face up .",46
cn29,This guy was strictly from Outsville .,47
cn29,But nowhere !,48
cn29,`` What is with this vow jazz '' ?,49
cn29,"Feathertop inquired , lounging against the freight's vibrating wall .",50
cn29,"`` We -- we eloped '' , Cappy said .",51
cn29,His head came up and he said it defiantly .,52
cn29,"`` Well , congratulations '' .",53
cn29,Feathertop made an elaborate motion with his hand .,54
cn29,These two were going to be easy pickins .,55
cn29,"They couldn't have much dough , but then none of the freight-bums Feathertop rolled had much .",56
cn29,"And besides , the chick had a little something the others didn't have .",57
cn29,That was gonna be fun collecting !,58
cn29,But not just yet .,59
cn29,Feathertop was a connoisseur .,60
cn29,He liked to savor his meat before he tasted it .,61
cn29,"`` Come sit '' , he repeated , motioning to the piled hay bags , over the pig leavings .",62
cn29,"`` I'm just a poor ex-jazz man , name of -- uh -- Boyd Smith '' .",63
cn29,He grinned at them wolfishly .,64
cn29,"`` That ain't your name , Mister '' , the boy accused .",65
cn29,`` And you know -- you're right '' !,66
cn29,Feathertop aimed a finger at him .,67
cn29,"`` Oh , come on , Cappy '' , the girl chided .",68
cn29,`` He's okay .,69
cn29,He's a nice guy '' .,70
cn29,"She started to move toward the hay bags , dragging the reluctant Cappy behind her .",71
cn29,"Feathertop watched the smooth scissoring of her slim , trim legs as she walked to the bags , and tucked them beneath her , smoothing the skirt out in a wide circle .",72
cn29,"He cleared his throat ; ; it had been a long , hot while since he'd seen anything as nice as this within grabbin' distance .",73
cn29,"He had it all doped , of course .",74
cn29,"Slug the kid , grab his dough -- at least enough to get to Philadelphia -- and then have a rockin' ball with the doll .",75
cn29,Hmm -- diddle !,76
cn29,"`` Where'd you come from , Mr. -- uh -- Mr. Smith '' ?",77
cn29,Kitty inquired politely .,78
cn29,`` Where from '' ?,79
cn29,He mused .,80
cn29,`` Out .,81
cn29,I been riding train for a ways now '' .,82
cn29,"They lapsed into silence , and the freight wallowed up a hill , scooted down the other side , shaking and clanking to itself .",83
cn29,"After a while , Kitty murmured something to Cappy , and he held her close , answering , `` We'll just have to wait till we pull into Philly , honey '' .",84
cn29,"`` What's the matter , she wanna go the bathroom '' ?",85
cn29,Ernie found it immensely funny .,86
cn29,"The boy scowled at him , and the girl looked shocked .",87
cn29,`` No !,88
cn29,"Certainly not , I mean , no that isn't what I said '' !",89
cn29,She snapped at him .,90
cn29,`` I only said I was hungry .,91
cn29,We haven't had anything to eat all day '' .,92
cn29,"Joviality suffused Feathertop Ernie Cargill's voice as he reached behind him , pulling out a battered carpet bag , with leather handles .",93
cn29,"`` Whyn't ya say so , fellow travelers !",94
cn29,"Why , we got dinner right here .",95
cn29,"C'mon , buddy , help me set up the kitchen and we'll have food in a minute or two '' .",96
cn29,"Cappy looked wary , but he moved off the floorboards and followed the dirty ex-musician to the center of the refuse-littered boxcar .",97
cn29,Ernie crouched and opened the carpet bag .,98
cn29,"He took out a small packet filled with bits of charcoal , a deep pot of thin metal , some sheets of newspaper , a book of matches and a wrinkled and many-times folded piece of tin foil with holes in it .",99
cn29,"He put the charcoal in the pot , lit the paper with the matches , and carefully stretched the tin foil across the top of the pot .",100
cn29,"`` A charcoal pit , man '' , he said , indicating the slightly-smoking makeshift brazier .",101
cn29,"`` Fan it '' , he told Cappy , handing him a sheet of newspaper .",102
cn29,"`` Yeah , but what're we gonna eat ?",103
cn29,Charcoal '' ?,104
cn29,"`` Fella '' , Ernie waggled a dirty finger at the younger man , `` you try my ever-lovin' patience '' .",105
cn29,He reached once more into the carpet bag and brought up a package of wieners .,106
cn29,"`` Hot dogs , man .",107
cn29,"Not the greatest , but they stick to your belly insides '' .",108
cn29,"He ripped down the cellophane carefully , and laid three dogs on the tin foil .",109
cn29,Almost immediately they began to sizzle .,110
cn29,He looked up and grinned .,111
cn29,"`` A Kroger's self-serve '' , he explained .",112
cn29,`` I self-served '' .,113
cn29,"When they had licked the last of the wieners' taste from their fingers , they settled back , and Cappy offered Ernie a cigarette .",114
cn29,"Nice kid , Ernie thought , too bad .",115
cn29,"`` How come you're riding the rods , kids like you '' ?",116
cn29,Ernie asked .,117
cn29,"Cappy looked down at his wide hands , and did not reply .",118
cn29,"But surprisingly , Kitty's face came up and she said , `` My father .",119
cn29,He didn't want us to get married .,120
cn29,So we ran away '' .,121
cn29,`` Why didn't he want you to get hitched '' ?,122
cn29,This time even she did not answer .,123
cn29,"She looked down at her hands , too .",124
cn29,"After a few seconds , she said , `` Dad didn't like Cappy .",125
cn29,It was my fault '' .,126
cn29,Cappy's head came around sharply .,127
cn29,"`` Your fault , hell !",128
cn29,It was all my fault .,129
cn29,If I'd been careful it never woulda '' -- he stopped abruptly .,130
cn29,Ernie's eyebrows went up .,131
cn29,`` What's the matter '' ?,132
cn29,"The girl still did not raise her eyes , but she added simply , `` I'm pregnant '' .",133
cn29,Cappy raged at himself .,134
cn29,"`` Oh he was stupid , her old man !",135
cn29,"You never heard nothin' like it : Kitty's gonna go have an abortion , and Kitty's gonna go away to a convent , and Kitty's this and Kitty's that like he was nuts or somethin' , y'know '' ?",136
cn29,Ernie nodded .,137
cn29,This was a slightly different matter .,138
cn29,"He remembered Midge , and the child .",139
cn29,"But that had been a time before all this , a time he didn't think about .",140
cn29,A time before the white lightning and the bumming had turned him inside out .,141
cn29,But these kids weren't like him .,142
cn29,Oh crap !,143
cn29,"He thought , Pull out of it , old son .",144
cn29,These are just another couple of characters to roll .,145
cn29,"What they got , you get .",146
cn29,Now forget all this other .,147
cn29,`` Wanna drink '' ?,148
cn29,"Ernie offered , taking the pint of sweet lucy from his jacket pocket .",149
cn29,`` Yeah .,150
cn29,Now that you offer '' .,151
cn29,The answer came from the open door of the boxcar .,152
cn29,"From the man who had leaped in from the high bank outside , as the train had slowed on the grade .",153
cn29,Ernie stared at the man .,154
cn29,He was big .,155
cn29,"Real big , with shoulders out to here , and hair all over him like a grizzly .",156
cn29,"Road gang , Ernie thought .",157
cn29,"`` You gonna give me a drink , fella '' ?",158
cn29,"The big man asked again , taking a step into the boxcar .",159
cn29,Ernie hesitated a moment .,160
cn29,This character could break him in half .,161
cn29,"`` Sure '' , he said , and lifted the pint to his own lips .",162
cn29,He guzzled down three-quarters of the strong home-blend and proffered the remainder .,163
cn29,"The man stalked toward them , his big boots heavy on the wooden flooring .",164
cn29,"He took the bottle with undue belligerence , and making sucking noises with his thick lips , drained it completely .",165
cn29,"He threw his head back , closed his eyes , and belched ferociously .",166
cn29,"He belched again , and opening his eyes , threw the bottle out the open door .",167
cn29,"`` Well , now '' , he said , and reached into his pocket .",168
cn29,`` I didn't know I was gonna have company in this car '' .,169
cn29,"`` We're going to Philadelphia '' , Kitty said , pulling her skirt down around her legs all the more .",170
cn29,"`` No , I don't think so '' , said the big man , and it was the final clincher for Ernie .",171
cn29,"He had suspected this guy was trouble , and now he was sure of it .",172
cn29,"`` Maybe you and me will , girlie , but these two ain't goin' nowhere '' .",173
cn29,"He advanced on them , and abruptly there was a shocked electricity in the car .",174
cn29,"Ernie was screaming inside himself : No , damn you , you ain't gonna take my meal ticket away from me !",175
cn29,"The newcomer stalked toward them , and Kitty shied back , her hand to her mouth .",176
cn29,"Her scream split up the silence of the car , accompanied by the rattling of the freight , and then Cappy came off the floor , his legs driving him hard .",177
cn29,The kid hit the bigger man with an audible thwump !,178
cn29,And carried him backward in a footballer's tackle .,179
cn29,They went down in a heap and for a long minute there was nothing to see but flailing arms and legs .,180
cn29,"The kid showed for an instant , and his arm was cocked back .",181
cn29,"The fist went down into the pile of flesh , and Ernie heard the bigger man's deeper voice go , `` Aaawww '' !",182
cn29,"Then they were tumbling again , and the big man reached into the same pocket he had gone for earlier , and came up with a vicious switchblade .",183
cn29,He held the knife aloft an instant -- an instant enough to press the stud .,184
cn29,The blade came out with a snick !,185
cn29,"He fisted the knife overhand , and drew back to plunge it into the kid's throat .",186
cn29,Kitty screamed insanely and her face was white .,187
cn29,"She grabbed at Feathertop's sleeve and shrieked , `` Help him !",188
cn29,Help him !,189
cn29,Do something '' !,190
cn17,"I guided her to the divan , turned off the TV , faced her .",191
cn17,"She sat quietly , staring at me from the wide eyes .",192
cn17,And what eyes they were .,193
cn17,"Big and dark , a melting , golden brown .",194
cn17,"Eyes like hot honey , eyes that sizzled .",195
cn17,"Plus flawless skin , smooth brow and cheeks , lips that looked as if you could get a shock from them .",196
cn17,"It was a disturbingly familiar face , too , but I couldn't remember where we had met .",197
cn17,"I said , `` Do we know each other , Miss '' ?",198
cn17,"`` No , I remembered reading about you in the papers and that you lived here , and when it happened all I could think of was '' -- This time she stopped the rush of words herself .",199
cn17,`` I'm sorry .,200
cn17,Shall I go on '' ?,201
cn17,She smiled .,202
cn17,It was her first smile .,203
cn17,But worth waiting for .,204
cn17,`` Sure '' .,205
cn17,I said .,206
cn17,"`` But one word at a time , O.K. ''",207
cn17,"She was still hugging the stained coat around her , so I said , `` Relax , let me take your things .",208
cn17,"Would you like a drink , or coffee '' ?",209
cn17,"`` No , thanks '' .",210
cn17,"She stood up , pulled the coat from her shoulders and started to slide it off , then let out a high-pitched scream and I let out a low-pitched , wobbling sound like a muffler blowing out .",211
cn17,She was wearing nothing beneath the coat .,212
cn17,"She jerked the coat back on and squeezed it around her again , but not soon enough .",213
cn17,"There had been a good second or two during which my muffler had been blowing out , and now I was certain I'd seen her somewhere before .",214
cn17,`` I forgot '' !,215
cn17,She yelped .,216
cn17,"`` Oh , do forgive me .",217
cn17,I'm sorry '' !,218
cn17,`` I forgive '' -- `` That's what started all the trouble in the first place .,219
cn17,"Oh , dear , I'm all unstrung '' .",220
cn17,"`` You and me both , dear .",221
cn17,Haven't we haven't I seen you .,222
cn17,"I mean , surely we've '' -- `` You may have seen me on TV '' , she said .",223
cn17,`` I've done several filmed commercials for '' -- Then it hit me .,224
cn17,`` Zing '' !,225
cn17,I cried .,226
cn17,"`` Why , yes .",227
cn17,And you recognized me '' ?,228
cn17,"`` Yes , indeed .",229
cn17,"In fact , I was watching you on that little seventeen-inch screen when you rang my bell .",230
cn17,"Man , you rang -- it was in color , too , Miss , and Miss ?",231
cn17,"What's your name , anyway ?",232
cn17,"Ah , you were splendid '' .",233
cn17,I sat by her on the divan .,234
cn17,`` Splendid .,235
cn17,In a waterfall and all that '' .,236
cn17,`` That's the last one we did .,237
cn17,That was a fun one '' .,238
cn17,`` I'll bet .,239
cn17,"It was fun for me , all right .",240
cn17,"I don't mean to pry , but do they hide the swimsuit with the bubbles ?",241
cn17,I mean : Is advertising honest ?,242
cn17,`` It depends on who does it .,243
cn17,I never wear anything at all .,244
cn17,"It wouldn't -- wouldn't seem fair , somehow '' .",245
cn17,`` I couldn't agree with you more '' .,246
cn17,"`` I really do have something important to tell you , Mr. Scott .",247
cn17,About the murder '' .,248
cn17,`` Murder ?,249
cn17,"Oh , yeah '' , I said .",250
cn17,`` Tell me about the murder '' .,251
cn17,She told me .,252
cn17,"Zing was the creation of two men , Louis Thor and Bill Blake , partners in zing !",253
cn17,", Inc. .",254
cn17,"They'd peddled the soap virtually alone , and without much success , until about a year ago , when -- with the addition of `` SX-21 '' to their secret formula and the inauguration of a high-powered advertising campaign -- sales had soared practically into orbit .",255
cn17,"Their product had been endorsed by Good Housekeeping , the A.M.A.",256
cn17,", and the Veterinary Journal , among other repositories of higher wisdom , and before much longer if you didn't have a cake of their soap in the john , even your best friends would think you didn't bathe .",257
cn17,"My lovely caller -- Joyce Holland was her name -- had previously done three filmed commercials for zing , and this evening , the fourth , a super production , had been filmed at the home of Louis Thor .",258
cn17,"The water in Thor's big swimming pool had been covered with a blanket of thick , foamy soapsuds -- fashioned , of course , from zing -- Joyce had dived from the board into the pool , then swirled and cavorted in her luxurious `` bath '' while cameras rolled .",259
cn17,"The finished -- and drastically cut -- product would begin with a hazy longshot of Joyce entering the suds , then bursting above the pool's surface clad in layers of lavender lather , and I had a hunch this item was going to sell tons and tons of soap ; ; even to clean men and boys .",260
cn17,"Joyce went on , `` When we'd finished , Lou -- Mr. Thor -- asked me to stay a little longer .",261
cn17,"He wanted a few stills for magazine ads , he said .",262
cn17,"Everybody left and I stayed in the pool , then Lou came back alone and leaped into the pool too .",263
cn17,And he didn't have any clothes on '' .,264
cn17,`` He didn't '' !,265
cn17,"`` Yes , he didn't .",266
cn17,"Did , I mean '' .",267
cn17,She paused .,268
cn17,"`` Did leap into the pool , and didn't have anything on .",269
cn17,"Anyway , it was evident what he had in mind '' .",270
cn17,"`` You got away , didn't you '' ?",271
cn17,`` Yes .,272
cn17,"He caught up with me once and grabbed me , but I was all covered with zing -- it's very slippery , you know '' .",273
cn17,`` I didn't know .,274
cn17,I wouldn't have the stuff in the house .,275
cn17,But I'm pleased to hear '' -- `` So I just scooted out of his clutches .,276
cn17,"I swam like mad , got out of the pool , grabbed my robe , and ran to the car .",277
cn17,"The keys were still in it , and I was miles away before I remembered that my clothes and purse and everything were still in the little cabana where I'd changed '' .",278
cn17,"She'd driven around for a while , Joyce said , then , thinking Louis Thor would have calmed down by that time , she'd gone back to his home on Bryn Mawr Drive , parked in front , and walked toward the pool .",279
cn17,"While several yards from it , still concealed by the shrubbery , she'd seen two men on her left at the pool's edge .",280
cn17,"She went on : `` A man was holding onto Lou , holding him up .",281
cn17,"Maybe Lou was only unconscious , but right then I thought he must be dead .",282
cn17,"The man shoved him into the water , then ran past the cabana .",283
cn17,There's a walk there that goes out to Quebec Drive .,284
cn17,"I was so scared well , I just ran to my car and came here '' .",285
cn17,`` You know who the other man was '' ?,286
cn17,"`` No , I never did see his face .",287
cn17,"I didn't get a good look at him at all , his back was to me , and I was so scared It was just somebody in a man's suit .",288
cn17,But I'm sure the other one was Lou '' .,289
cn17,"What Joyce wanted me to do was go to Thor's house and `` do whatever detectives do '' , and get her clothes -- and handbag containing her identification .",290
cn17,"She realized I'd have to notify the police , but fervently hoped I could avoid mentioning her name .",291
cn17,"Her impact in the zing commercials had led to her being considered for an excellent part in an upcoming TV series , Underwater Western Eye , a documentary-type show to be sponsored by Oatnut Grits .",292
cn17,"But if Joyce got involved in murder or salacious scandal , the role would probably go to the sponsor's wife , Mrs. Oatnut Grits .",293
cn17,Or at least not to Joyce .,294
cn17,"`` And I so want the part '' , she said .",295
cn17,"`` The commercials have just been for money , there hasn't been any real incentive for me to do them , but in Underwater Western Eye I'd have a chance to act .",296
cn17,I could show what I can do '' .,297
cn17,"As far as I was concerned , she had already and had dandily shown what she could do .",298
cn17,"But I promised Joyce I would mention her name , if at all , only as a last resort .",299
cn17,"Seeming much relieved , she smiled one of those worth-waiting-for smiles , and I smiled all the way into the bedroom .",300
cn17,"There I got my Colt Special and shoulder harness , slipped my coat on , and went back into the front room .",301
cn17,Joyce squirmed a little on the divan .,302
cn17,"`` I'm starting to itch '' , she said .",303
cn17,`` Itch '' ?,304
cn17,"`` Yes , I'm still all covered with that soap .",305
cn17,"I was loaded with suds when I ran away , and I haven't had a chance to wash it off .",306
cn17,"Mmmm , it sure itches '' .",307
cn17,"`` You might as well wait here while I'm gone , so you can use my shower if you'd like '' .",308
cn17,"`` Oh , I'd love to '' .",309
cn17,"I showed her the shower and tub , and she said , smiling , `` If you really don't mind , I think I'll get clean in the shower , then soak for a few minutes in your tub .",310
cn17,That always relaxes me .,311
cn17,Doesn't it you '' ?,312
cn17,`` Only when I do it '' .,313
cn17,I shook my head .,314
cn17,One of my virtues or vices is a sort of three-dimensional imagination complete with sound effects and glorious living color .,315
cn17,"`` Soak as long as you want , Joyce .",316
cn17,It'll probably be at least an hour or two before I can check back with you .,317
cn17,"So you'll have everything all to yourself , doggone '' I looked at my watch .",318
cn17,Ten after nine .,319
cn17,"Time to go , I supposed .",320
cn17,"`` Well , goodbye '' , I said .",321
cn17,`` Goodbye .,322
cn17,You'd better hurry '' .,323
cn17,"`` Oh , you can count on that '' .",324
cn17,She smiled slightly .,325
cn17,Softly .,326
cn17,Warmly .,327
cn17,`` Don't hurry too much .,328
cn17,I'll be soaking for at least half an hour '' .,329
cn17,That was all she said .,330
cn17,But suddenly those hot-honey eyes seemed to have everything but swarms of bees in them .,331
cn17,"However , when there's a job to be done , I'm a monstrosity of grim determination , I like to think .",332
cn17,I spun about and clattered through the front room to the door .,333
cn17,"As I went out , I could hear water pouring in the shower .",334
cn17,Hot water .,335
cn17,She wouldn't be taking a cold shower .,336
cn17,"Hell , she couldn't .",337
cn17,"Bryn Mawr Drive is only two or three miles from the Spartan , and it took me less than five minutes to get there .",338
cn17,"But the scene was not the quiet , calm scene I'd expected .",339
cn17,"Four cars were parked at the curb , and two of them were police radio cars .",340
cn17,Lights blazed in the big house and surrounding grounds .,341
cn17,I followed a shrubbery-lined gravel path alongside the house to the pool .,342
cn17,"Two uniformed officers , a couple of plain-clothesmen I knew , and two other men stood on a gray cement area next to the pool on my left .",343
cn17,"At the pool's far end was the little cabana Joyce had mentioned , and on the water's surface floated scattered lavender patches of limp-looking lather .",344
cn17,"A few yards beyond the group of men , a man's nude body lay face down on a patch of thick green dichondra .",345
cn17,"Lieutenant Rawlins , one of the plain-clothesmen , spotted me and said , `` Hi , Shell '' , and walked toward me .",346
cn17,`` How'd you hear about this one '' ?,347
cn17,"I grinned , but ignored the question .",348
cn17,He didn't push it ; ; Rawlins worked out of Central Homicide and we'd been friends for years .,349
cn17,He filled me in .,350
cn17,"A call to the police had been placed from here a couple of minutes after nine P.M. , and the first police car had arrived two or three minutes after that -- 10 minutes ago now .",351
cn17,"Present at the scene -- in addition to the dead man , who was indeed Louis Thor -- had been Thor's partner Bill Blake , and Antony Rose , an advertising agency executive who handled the zing account .",352
cn17,"Neither of them , I understood , had been present at the filming session earlier .",353
